{
    "$schema": "http://json-schema.org/draft-07/schema#",
    "$id": "https://example.com/schemas/chapter-schema.json",
    "title": "Cookbook Chapter",
    "description": "A single chapter of the cookbook, containing a hierarchical tree of sections whose leaves reference entry identifiers.",
    "$defs": {
        "Section": {
            "title": "Chapter Section",
            "description": "A named subdivision of a chapter or another section. Sections may be nested arbitrarily deep. Leaf sections carry a list of entry identifiers in the order they appear in the text.",
            "type": "object",
            "properties": {
                "_id": {
                    "type": "string",
                    "description": "Machine-readable identifier for the section (e.g., 'chapter-i/section-1')."
                },
                "title": {
                    "type": "string",
                    "description": "The display title of the section."
                },
                "introduction": {
                    "type": "array",
                    "description": "Introductory paragraphs for this section.",
                    "items": {
                        "type": "string"
                    }
                },
                "entryIDs": {
                    "type": "array",
                    "description": "Ordered list of entry identifiers belonging directly to this section.",
                    "items": {
                        "type": "string",
                        "description": "An entry identifier matching the _id field in entries.json."
                    }
                },
                "sections": {
                    "type": "array",
                    "description": "Nested sub-sections within this section.",
                    "items": {
                        "$ref": "#/$defs/Section"
                    }
                }
            },
            "required": ["_id", "title", "introduction", "entryIDs", "sections"]
        }
    },
    "type": "object",
    "properties": {
        "_id": {
            "type": "string",
            "description": "Machine-readable identifier for the chapter (e.g., 'chapter-i')."
        },
        "chapter": {
            "type": "string",
            "description": "The chapter number expressed as a Roman numeral (e.g., 'I', 'XIV')."
        },
        "title": {
            "type": "string",
            "description": "The display title of the chapter."
        },
        "introduction": {
            "type": "array",
            "description": "Introductory paragraphs for the chapter as a whole.",
            "items": {
                "type": "string"
            }
        },
        "sections": {
            "type": "array",
            "description": "The top-level sections within this chapter.",
            "items": {
                "$ref": "#/$defs/Section"
            }
        }
    },
    "required": ["_id", "chapter", "title", "introduction", "sections"]
}
