{
    "_id": "chapter-iii",
    "chapter": "III",
    "title": "The Small Compound Sauces",
    "introduction": [
        "In order that the classification of the small sauces should be clear and methodical, I divide them into three parts.",
        "The first part includes the small brown sauces; the second deals with the small white sauces and those suited to this part of the classification; while the third is concerned with the English sauces."
    ],
    "sections": [
        {
            "_id": "chapter-iii/section-1",
            "title": "The Small Brown Sauces",
            "introduction": [],
            "entryIDs": [
                "31",
                "32",
                "33",
                "34",
                "35",
                "36",
                "37",
                "38",
                "38.1",
                "39",
                "40",
                "41",
                "42",
                "43",
                "44",
                "45",
                "46",
                "47",
                "48",
                "49",
                "50",
                "51",
                "52",
                "53",
                "54",
                "55",
                "56",
                "57"
            ],
            "sections": []
        },
        {
            "_id": "chapter-iii/section-2",
            "title": "Small White and Compound Sauces",
            "introduction": [],
            "entryIDs": [
                "58",
                "59",
                "60",
                "61",
                "62",
                "63",
                "64",
                "65",
                "66",
                "67",
                "68",
                "69",
                "70",
                "71",
                "72",
                "73",
                "74",
                "75",
                "76",
                "77",
                "78",
                "79",
                "80",
                "81",
                "82",
                "83",
                "84",
                "85",
                "86",
                "87",
                "88",
                "89",
                "90",
                "91",
                "92",
                "93",
                "94",
                "95",
                "96",
                "97",
                "98",
                "99",
                "100",
                "101",
                "102",
                "103",
                "104",
                "105",
                "106",
                "106.1",
                "107",
                "108",
                "109",
                "110",
                "111"
            ],
            "sections": []
        },
        {
            "_id": "chapter-iii/section-3",
            "title": "Hot English Sauces",
            "introduction": [],
            "entryIDs": [
                "112",
                "113",
                "114",
                "115",
                "116",
                "117",
                "118",
                "119",
                "119.1",
                "120"
            ],
            "sections": []
        }
    ]
}
