{
    "_id": "chapter-xiii",
    "chapter": "XIII",
    "title": "SOUPS",
    "introduction": [
        "Soups are divided into two leading classes, viz.:—",
        "1. Clear soups, which include plain and garnished consommés. 2. Thick soups, which comprise the Purées, Veloutés, and Creams.",
        "A third class, which is independent of either of the above, inasmuch as it forms part of plain, household cookery, embraces vegetable soups and Garbures or _gratined_ soups. But in important dinners—by this I mean rich dinners—only the first two classes are recognised.",
        "When a menu contains two soups, one must be clear and the other thick. If only one is to be served, it may be either clear or thick, in which case the two kinds are represented alternately at different meals.",
        "In Part I. of this work I indicated the general mode of procedure for consommés and thick soups; I explained how the latter might be converted from plain purées into veloutés or creams, or from veloutés into creams; and all that now remains is to reveal the recipes proper to each of those soups.",
        "_Remarks._—In the course of the recipes for consommés, given hereafter, the use of Royales (Nos. 206 to 213) and of Quenelles, variously prepared (Nos. 193 to 195 and 205), will often be enjoined. For the preparation of these garnishes, therefore, the reader will have to refer to the numbers indicated.",
        "The quantities for the clear soups that follow are all calculated to be sufficient for a standard number of six people, and the quantity of Royales is always given in so many _dariole-moulds_, which contain about one-eighth pint, or _baba-moulds_, which hold about one-fifth pint.",
        "Of course, it will be understood that the poaching need not necessarily have been effected in these moulds, for very small “Charlotte” moulds would do quite as well. But I had recourse to the particular utensils mentioned above, in order that there might be no sort of doubt as to the exact quantity of royale it would be necessary to prepare for any one of the soups."
    ],
    "sections": [
        {
            "_id": "chapter-xiii/section-1",
            "title": "Clear Soups and Garnished Consommés",
            "introduction": [],
            "entryIDs": [
                "539",
                "540",
                "541",
                "542",
                "543",
                "544",
                "545",
                "546",
                "547",
                "548",
                "549",
                "550",
                "551",
                "552",
                "553",
                "554",
                "555",
                "556",
                "557",
                "558",
                "559",
                "560",
                "561",
                "562",
                "563",
                "564",
                "565",
                "566",
                "566.1",
                "567",
                "568",
                "569",
                "570",
                "571",
                "572",
                "573",
                "574",
                "575",
                "576",
                "576.1",
                "577",
                "578",
                "579",
                "580",
                "581",
                "582",
                "583",
                "584",
                "585",
                "586",
                "587",
                "588",
                "589",
                "590",
                "591",
                "592",
                "593",
                "594",
                "595",
                "596",
                "597",
                "598",
                "599",
                "600",
                "601",
                "602",
                "603",
                "604",
                "605",
                "606",
                "607",
                "608",
                "609",
                "610",
                "611",
                "612",
                "613",
                "614",
                "615",
                "616",
                "617"
            ],
            "sections": []
        },
        {
            "_id": "chapter-xiii/section-2",
            "title": "Special Cold Consommé for Suppers",
            "introduction": [
                "_Remarks Relative to the Consommés._—I gave the recipes of these consommés in Part I. of this work (Recipe 6), and shall now, therefore, limit myself to the following remarks, which are of paramount importance:—",
                "1. These consommés must be perfect in limpidness and quality.",
                "2. The flavour which typifies them should be at once decided and yet not too pronounced.",
                "3. When the flavour is imparted by a wine, the latter should be of the best possible quality. Rather than make use of inferior wines, the presence of which in the soup would tend to depreciate its quality, completely discard wine flavourings.",
                "4. Supper consommés never contain any garnish."
            ],
            "entryIDs": [
                "618",
                "619",
                "620",
                "621",
                "622",
                "623",
                "624",
                "625",
                "626",
                "627",
                "628",
                "629"
            ],
            "sections": []
        },
        {
            "_id": "chapter-xiii/section-3",
            "title": "Thick Soups",
            "introduction": [
                "In Part I., Chapter I., of this work I pointed out what thick soups consist of. I likewise touched upon the general rules which should be observed in the preparation of each class of these soups, and showed how most of them could, if necessary, be converted into and served as cullises, purées, bisques, veloutés, or creams. The principles governing these alterations are very simple, and after a moment’s reflection the operator will thoroughly grasp their import. Be this as it may, the reader will find the necessary directions at the end of each recipe that admits of various methods of preparation.",
                "With regard to those recipes which are not followed by any directions of the sort referred to, and which I simply class under the name of Potages, these are unalterable preparations which may only be served in accordance with the directions given. This being clear, the reader will understand that I have refrained from repeating the quantities of butter, cream, thickening ingredients, &c., in each recipe. These particulars having been given in Part I., it will be necessary to refer to that part of the book for them."
            ],
            "entryIDs": [
                "630",
                "631",
                "632",
                "633",
                "634",
                "635",
                "636",
                "637",
                "638",
                "639",
                "640",
                "641",
                "642",
                "643",
                "644",
                "645",
                "646",
                "647",
                "648",
                "649",
                "650",
                "651",
                "652",
                "653",
                "654",
                "655",
                "656",
                "657",
                "658",
                "659",
                "660",
                "661",
                "662",
                "663",
                "664",
                "665",
                "666",
                "667",
                "668",
                "669",
                "670",
                "671",
                "672",
                "673",
                "674",
                "675",
                "676",
                "677",
                "678",
                "679",
                "680",
                "681",
                "682",
                "683",
                "684",
                "685",
                "686",
                "687",
                "688",
                "689",
                "690",
                "691",
                "692",
                "693",
                "694",
                "695",
                "695.1",
                "696",
                "697",
                "698",
                "699",
                "700",
                "701",
                "702",
                "703",
                "704",
                "705",
                "706",
                "707",
                "708",
                "709",
                "710",
                "711",
                "712",
                "713",
                "714",
                "715",
                "716",
                "717",
                "718",
                "719",
                "720",
                "721",
                "722",
                "723",
                "724",
                "725",
                "726",
                "727",
                "728",
                "729",
                "730",
                "731",
                "732",
                "733",
                "734",
                "735",
                "736",
                "737",
                "738",
                "739",
                "740",
                "741",
                "742",
                "743",
                "744",
                "745",
                "746",
                "747",
                "748",
                "749",
                "750",
                "751",
                "752"
            ],
            "sections": []
        }
    ]
}
