{
    "_id": "chapter-vii",
    "chapter": "VII",
    "title": "Elementary Preparations",
    "introduction": [],
    "sections": [
        {
            "_id": "chapter-vii/section-1",
            "title": "1. Elementary Preparations",
            "introduction": [
                "Before broaching the question of the numerous preparations which constitute the various soup, relevé, and entrée garnishes, it will be necessary to give the formulæ of the elementary preparations, or what are technically called the mise en place. If the various operations which go to make the mise en place were not, at least summarily, discussed here, I should be compelled to repeat them in each formula for which they are required—that is to say, in almost every formula. I should thus resemble those bad operators who, having neglected their mise en place, are obliged to make it in the course of other work, and thereby not only run the risk of making it badly, but also of losing valuable time which might be used to better advantage.",
                "Elementary preparations consist of those things whereof one is constantly in need, which may be prepared in advance, and which are kept available for use at a moment’s notice."
            ],
            "entryIDs": [
                "173",
                "174",
                "174.1",
                "174.2",
                "175",
                "176",
                "177",
                "178",
                "179",
                "180",
                "181",
                "182",
                "183",
                "184",
                "185",
                "186",
                "187",
                "188"
            ],
            "sections": []
        },
        {
            "_id": "chapter-vii/section-2",
            "title": "2. The Various Kinds of Garnishes for Soups, Relevés, and Entrées, Hot or Cold",
            "introduction": [],
            "entryIDs": [],
            "sections": [
                {
                    "_id": "chapter-vii/section-2/section-1",
                    "title": "STUFFINGS AND FORCEMEATS",
                    "introduction": [],
                    "entryIDs": [
                        "189",
                        "190",
                        "191",
                        "192",
                        "193",
                        "194",
                        "195",
                        "196",
                        "197",
                        "198",
                        "199",
                        "200",
                        "201",
                        "202",
                        "203",
                        "204",
                        "205"
                    ],
                    "sections": []
                }
            ]
        }
    ]
}
