{
    "_id": "chapter-i",
    "chapter": "I",
    "title": "FONDS DE CUISINE",
    "introduction": [
        "Before undertaking the description of the different kinds of dishes whose recipes I purpose giving in this work, it will be necessary to reveal the groundwork whereon these recipes are built. And, although this has already been done again and again, and is wearisome in the extreme, a text-book on cooking that did not include it would be not only incomplete, but in many cases incomprehensible.",
        "Notwithstanding the fact that it is the usual procedure, in culinary matters, to insist upon the importance of the part played by stock, I feel compelled to refer to it at the outset of this work, and to lay even further stress upon what has already been written on the subject.",
        "Indeed, stock is everything in cooking, at least in French cooking. Without it, nothing can be done. If one’s stock is good, what remains of the work is easy; if, on the other hand, it is bad or merely mediocre, it is quite hopeless to expect anything approaching a satisfactory result.",
        "The workman mindful of success, therefore, will naturally direct his attention to the faultless preparation of his stock, and, in order to achieve this result, he will find it necessary not merely to make use of the freshest and finest goods, but also to exercise the most scrupulous care in their preparation, for, in cooking, care is half the battle. Unfortunately, no theories, no formulæ, and no recipes, however well written, can take the place of practical experience in the acquisition of a full knowledge concerning this part of the work—the most important, the most essential, and certainly the most difficult part.",
        "In the matter of stock it is, above all, necessary to have a sufficient quantity of the finest materials at one’s disposal. The master or mistress of a house who stints in this respect thereby deliberately forfeits his or her right to make any remark whatsoever to the chef concerning his work, for, let the talent or merits of the latter be what they may, they are crippled by insufficient or inferior material. It is just as absurd to exact excellent cooking from a chef whom one provides with defective or scanty goods, as to hope to obtain wine from a bottled decoction of logwood."
    ],
    "sections": [
        {
            "_id": "chapter-i/section-1",
            "title": "The Principal Kinds of Fonds de Cuisine (Foundation Sauces and Stocks)",
            "introduction": [
                "The principal kinds of fonds de cuisine are:—",
                "1. Ordinary and clarified consommés.",
                "2. The brown stock or “estouffade,” game stocks, the bases of thickened gravies and of brown sauces.",
                "3. White stock, basis of white sauces.",
                "4. Fish stock.",
                "5. The various essences of poultry, game, fish, &c., the complements of small sauces.",
                "6. The various glazes: meat, game, and poultry.",
                "7. The basic sauces: Espagnole, Velouté, Béchamel, Tomato, and Hollandaise.",
                "8. The savoury jellies or aspics of old-fashioned cooking.",
                "To these kinds of stock, which, in short, represent the buttresses of the culinary edifice, must now be added the following preparations, which are, in a measure, the auxiliaries of the above:—",
                "1. The roux, the cohering element in sauces.",
                "2. The “Mirepoix” and “Matignon” aromatic and flavouring elements.",
                "3. The “Court-Bouillon” and the “Blancs.”",
                "4. The various stuffings.",
                "5. The marinades.",
                "6. The various garnishes for soups, for relevés, for entrées, &c. (“Duxelle,” “Duchesse,” “Dauphine,” Pâte à choux, frying batters, various Salpicons, Profiterolles, Royales, Œufs filés, Diablotins, Pastes, &c.)."
            ],
            "entryIDs": [
                "1",
                "2",
                "3",
                "4",
                "5",
                "6",
                "7",
                "8",
                "9",
                "10",
                "11",
                "12",
                "13",
                "14",
                "15",
                "16",
                "17",
                "18"
            ],
            "sections": []
        }
    ]
}
